{
  "table": "bestiary",
  "schemaVersion": 1,
  "dataVersion": 2,
  "gameVersion": "0.27.1",
  "generatedAt": "2026-10-18T22:00:00Z",
  "license": "MIT",
  "sources": {
    "neu": {
      "title": "NEU-REPO constants/bestiary.json, trimmed and reshaped into family rows",
      "url": "https://github.com/NotEnoughUpdates/NotEnoughUpdates-REPO",
      "revision": "24564a1ad22fdb0ca985d78710c401898eac586b",
      "license": "MIT",
      "notice": "neu-repo",
      "access": "git"
    },
    "game_logs": {
      "title": "Tier-ups in the maintainer's 26.2 chat logs: Hewver and Parched IX to X",
      "revision": "captured 2026-08-10 and 2026-08-12",
      "license": "CC0-1.0",
      "access": "user_supplied"
    },
    "hypixel_api_reborn": {
      "title": "Hypixel-API-Reborn src/Utils/constants.ts, bestiary brackets (facts only)",
      "url": "https://github.com/Hypixel-API-Reborn/hypixel-api-reborn",
      "revision": "b47774b5aeb0e26cfc871e8f4869158082b6b641",
      "license": "facts",
      "access": "git"
    },
    "kyuwa_caps": {
      "title": "KyuWa FamilyAddons bestiary_caps.json, caps read in game (facts only)",
      "url": "https://github.com/KyuWa/FamilyAddons-Public-26.2",
      "revision": "7d8a09465bae9753be99baeeb36d38af69a84d8c",
      "license": "facts",
      "access": "git"
    }
  },
  "brackets": {
    "1": [20,40,60,100,200,400,800,1400,2000,3000,6000,12000,20000,30000,40000,50000,60000,72000,86000,100000,200000,400000,600000,800000,1000000],
    "2": [5,10,15,25,50,100,200,350,500,750,1500,3000,5000,7500,10000,12500,15000,18000,21500,25000,50000,100000,150000,200000,250000],
    "3": [4,8,12,16,20,40,80,140,200,300,600,1200,2000,3000,4000,5000,6000,7200,8600,10000,20000,40000,60000,80000,100000],
    "4": [2,4,6,10,15,20,25,35,50,75,150,300,500,750,1000,1350,1650,2000,2500,3000,5000,10000,15000,20000,25000],
    "5": [1,2,3,5,7,10,15,20,25,30,60,120,200,300,400,500,600,720,860,1000,2000,4000,6000,8000,10000],
    "6": [1,2,3,5,7,9,14,17,21,25,50,80,125,175,250,325,425,525,625,750,1500,3000,4500,6000,7500],
    "7": [1,2,3,5,7,9,11,14,17,20,30,40,55,75,100,150,200,275,375,500,1000,1500,2000,2500,3000],
    "8": [1,2,3,4,5,8,11,14,17,20,25,30,35,40,50,60,70,80,90,100,120,140,160,180,200],
    "critters_1": [1,5,10,20,35,50,65,85,105,125],
    "critters_2": [1,5,10,15,25,40,55,70,85,100],
    "critters_3": [1,5,10,15,20,25,35,45,60,75],
    "critters_4": [1,3,6,10,15,20,25,30,40,50],
    "critters_5": [1,2,3,4,6,8,10,15,20,25]
  },
  "categories": {
    "dynamic": {"name":"Private Island"},
    "hub": {"name":"Hub"},
    "farming_1": {"name":"The Farming Islands"},
    "combat_1": {"name":"Spider's Den"},
    "combat_3": {"name":"The End"},
    "crimson_isle": {"name":"Crimson Isle"},
    "mining_2": {"name":"Deep Caverns"},
    "mining_3": {"name":"Dwarven Mines"},
    "crystal_hollows": {"name":"Crystal Hollows"},
    "foraging_1": {"name":"The Park"},
    "foraging_2": {"name":"Moonglade Marsh"},
    "spooky_festival": {"name":"Spooky Festival"},
    "mythological_creatures": {"name":"Mythological Creatures"},
    "jerry": {"name":"Jerry"},
    "kuudra": {"name":"Kuudra"},
    "fishing": {"name":"Fishing","subcategories":{"fishing":{"name":"Fishing"},"lava":{"name":"Lava"},"spooky_festival":{"name":"Spooky Festival"},"fishing_festival":{"name":"Fishing Festival"},"winter":{"name":"Winter"},"backwater_bayou":{"name":"Backwater Bayou"}}},
    "catacombs": {"name":"Catacombs"},
    "garden": {"name":"Garden"},
    "lotus_atoll": {"name":"Lotus Atoll"},
    "foraging_3": {"name":"Torrhus Canyon"},
    "safari": {"name":"Critter Safari","subcategories":{"cavern_biome":{"name":"Cavern Biome"},"forest_biome":{"name":"Forest Biome"},"haunted_biome":{"name":"Haunted Biome"},"icy_biome":{"name":"Icy Biome"}}}
  },
  "rows": [
    {"id":"bat_dynamic","name":"Bat","category":"dynamic","bracket":"2","cap":50,"maxTiers":5,"mobs":["forest_island_bat_3"]},
    {"id":"creeper","name":"Creeper","category":"dynamic","bracket":"2","cap":50,"maxTiers":5,"mobs":["creeper_1"]},
    {"id":"enderman_dynamic","name":"Enderman","category":"dynamic","bracket":"2","cap":50,"maxTiers":5,"mobs":["enderman_1","enderman_2","enderman_3","enderman_4","enderman_5","enderman_6","enderman_7","enderman_8","enderman_9","enderman_10","enderman_11","enderman_12","enderman_13","enderman_14","enderman_15"]},
    {"id":"skeleton","name":"Skeleton","category":"dynamic","bracket":"2","cap":50,"maxTiers":5,"mobs":["skeleton_1","skeleton_2","skeleton_3","skeleton_4","skeleton_5","skeleton_6","skeleton_7","skeleton_8","skeleton_9","skeleton_10","skeleton_11","skeleton_12","skeleton_13","skeleton_14","skeleton_15"]},
    {"id":"slime","name":"Slime","category":"dynamic","bracket":"2","cap":50,"maxTiers":5,"mobs":["slime_1","slime_2","slime_3","slime_4","slime_5","slime_6","slime_7","slime_8","slime_9","slime_10","slime_11","slime_12","slime_13","slime_14","slime_15"]},
    {"id":"spider","name":"Spider","category":"dynamic","bracket":"2","cap":50,"maxTiers":5,"mobs":["spider_1","spider_2","spider_3","spider_4","spider_5","spider_6","spider_7","spider_8","spider_9","spider_10","spider_11","spider_12","spider_13","spider_14","spider_15"]},
    {"id":"witch","name":"Witch","category":"dynamic","bracket":"2","cap":50,"maxTiers":5,"mobs":["witch_1","witch_2","witch_3","witch_4","witch_5","witch_6","witch_7","witch_8","witch_9","witch_10","witch_11","witch_12","witch_13","witch_14","witch_15"]},
    {"id":"zombie","name":"Zombie","category":"dynamic","bracket":"2","cap":50,"maxTiers":5,"mobs":["zombie_1","zombie_2","zombie_3","zombie_4","zombie_5","zombie_6","zombie_7","zombie_8","zombie_9","zombie_10","zombie_11","zombie_12","zombie_13","zombie_14","zombie_15"]},
    {"id":"crypt_ghoul","name":"Crypt Ghoul","category":"hub","bracket":"2","cap":25000,"maxTiers":20,"mobs":["unburried_zombie_30"]},
    {"id":"golden_ghoul","name":"Golden Ghoul","category":"hub","bracket":"4","cap":1000,"maxTiers":15,"mobs":["unburried_zombie_60"]},
    {"id":"graveyard_zombie","name":"Graveyard Zombie","category":"hub","bracket":"1","cap":200,"maxTiers":5,"mobs":["graveyard_zombie_1"]},
    {"id":"old_wolf","name":"Old Wolf","category":"hub","bracket":"5","cap":400,"maxTiers":15,"mobs":["old_wolf_50"]},
    {"id":"shiny_pig","name":"Shiny Pig","category":"hub","bracket":"5","cap":400,"maxTiers":15,"mobs":["shiny_pig_1"]},
    {"id":"wolf","name":"Wolf","category":"hub","bracket":"3","cap":4000,"maxTiers":15,"mobs":["ruin_wolf_15"]},
    {"id":"zombie_villager","name":"Zombie Villager","category":"hub","bracket":"1","cap":200,"maxTiers":5,"mobs":["zombie_villager_1"]},
    {"id":"chicken","name":"Chicken","category":"farming_1","bracket":"1","cap":200,"maxTiers":5,"mobs":["farming_chicken_1"]},
    {"id":"cow","name":"Cow","category":"farming_1","bracket":"1","cap":200,"maxTiers":5,"mobs":["farming_cow_1"]},
    {"id":"mushroom_cow","name":"Mushroom Cow","category":"farming_1","bracket":"1","cap":200,"maxTiers":5,"mobs":["mushroom_cow_1"]},
    {"id":"pig","name":"Pig","category":"farming_1","bracket":"1","cap":200,"maxTiers":5,"mobs":["farming_pig_1"]},
    {"id":"rabbit","name":"Rabbit","category":"farming_1","bracket":"1","cap":200,"maxTiers":5,"mobs":["farming_rabbit_1"]},
    {"id":"sheep","name":"Sheep","category":"farming_1","bracket":"1","cap":200,"maxTiers":5,"mobs":["farming_sheep_1"]},
    {"id":"arachne","name":"Arachne","category":"combat_1","bracket":"7","cap":100,"maxTiers":15,"mobs":["arachne_500","arachne_300"]},
    {"id":"arachnes_brood","name":"Arachne's Brood","category":"combat_1","bracket":"4","cap":1000,"maxTiers":15,"mobs":["arachne_brood_200","arachne_brood_100"]},
    {"id":"arachnes_keeper","name":"Arachne's Keeper","category":"combat_1","bracket":"6","cap":250,"maxTiers":15,"mobs":["arachne_keeper_100"]},
    {"id":"broodmother","name":"Broodmother","category":"combat_1","bracket":"7","cap":100,"maxTiers":15,"mobs":["brood_mother_spider_12"]},
    {"id":"dasher_spider","name":"Dasher Spider","category":"combat_1","bracket":"2","cap":10000,"maxTiers":15,"mobs":["dasher_spider_50","dasher_spider_45","dasher_spider_42","dasher_spider_4","dasher_spider_6"]},
    {"id":"flint_skeleton","name":"Flint Skeleton","category":"combat_1","bracket":"4","cap":1000,"maxTiers":15,"mobs":["respawning_skeleton_2"]},
    {"id":"rain_slime","name":"Rain Slime","category":"combat_1","bracket":"4","cap":1000,"maxTiers":15,"mobs":["random_slime_8","random_slime_20"]},
    {"id":"silverfish","name":"Silverfish","category":"combat_1","bracket":"2","cap":10000,"maxTiers":15,"mobs":["jockey_shot_silverfish_3","splitter_spider_silverfish_2","splitter_spider_silverfish_45","splitter_spider_silverfish_42","splitter_spider_silverfish_50","jockey_shot_silverfish_42"]},
    {"id":"spider_jockey","name":"Spider Jockey","category":"combat_1","bracket":"4","cap":1000,"maxTiers":15,"mobs":["spider_jockey_3","spider_jockey_42","spider_jockey_5"]},
    {"id":"splitter_spider","name":"Splitter Spider","category":"combat_1","bracket":"4","cap":3000,"maxTiers":20,"mobs":["splitter_spider_2","splitter_spider_45","splitter_spider_42","splitter_spider_50","splitter_spider_4","splitter_spider_6"]},
    {"id":"voracious_spider","name":"Voracious Spider","category":"combat_1","bracket":"4","cap":3000,"maxTiers":20,"mobs":["voracious_spider_50","voracious_spider_42","voracious_spider_45","voracious_spider_10"]},
    {"id":"weaver_spider","name":"Weaver Spider","category":"combat_1","bracket":"4","cap":3000,"maxTiers":20,"mobs":["weaver_spider_3","weaver_spider_4","weaver_spider_5","weaver_spider_6","weaver_spider_42","weaver_spider_45","weaver_spider_50"]},
    {"id":"dragon","name":"Dragon","category":"combat_3","bracket":"6","cap":250,"maxTiers":15,"mobs":["protector_dragon_100","old_dragon_100","young_dragon_100","wise_dragon_100","superior_dragon_100","strong_dragon_100","unstable_dragon_100"]},